Sr.No.,Utterances,Response
1,What is Leapwork?,Leapwork is a software automation platform that allows users to create and execute automated tests and workflows without writing code.
2,Know about leapwork,"It provides a visual, no-code interface for building automation tasks, making it accessible to both technical and non-technical users."
3,Description of leapwork,"Leapwork is commonly used for test automation, robotic process automation (RPA), and business process automation (BPA) in various"
4,Leapwork," industries such as software development, finance, healthcare, and more."
5,Features of leapwork,
6,Leapwork features,
7,Test automation leapwork,
8,About leapwork,
9,Leapwork uses cases,
10,Leapwork test automation,
11,Test automation ,
12,Test Automated process,
13,No-code features,
14,Test automation feature,
15,test automation feature leapwork,
16,Leapwork test automation feature,
17,What Leapwork do?,
18,Business process of leapwork,
19,Used in which companies,
20,Automation Test help using leapwork,
21,What are the Leapwork products,Leapwork offers a comprehensive range of products designed to cater to both on-premise and Software-as-a-Service (SaaS) deployment models. These products are categorized into different packages tailored to meet various business needs. Here's a more in-depth look at Leapwork's offerings in each category:
,,
,,On-Premise Products:
,,Enterprise Biz Apps Special Package: This package is designed for enterprises looking to automate business applications comprehensively. It includes features and capabilities specifically suited for handling complex business processes and applications.
,,
,,"Enterprise Light Starter Package on Premise: This package is ideal for enterprises starting with automation initiatives. It provides a lighter version of the Enterprise package, suitable for initial automation projects and scalability."
,,
,,Enterprise Light Starter Package on Premise (Customize Enterprise edition): This customized edition of the Light Starter Package allows enterprises to tailor the automation capabilities according to their specific requirements and workflows.
22,Leapwork products,
23,type of products,"Enterprise Starter Package on Premise: The Enterprise Starter Package offers a more comprehensive set of automation features compared to the Light Starter Package, making it suitable for medium to large enterprises with diverse automation needs."
24,type of products leapwork support,
25,Microsoft specific products,"Enterprise Starter Package on Premise (Customize Enterprise edition): Similar to the Light Starter Package, this version allows customization of automation capabilities for medium to large enterprises."
26,Does Leapwork support SaaS?,
27,Kind of products provide by Leapwork,"Self Service Package on Premise: This package is designed for self-service automation, empowering teams to create and manage their automation workflows independently."
28,What kind of products Leapwork supoort,
29,On Premises and SaaS products,"SME Starter Package on Premise: Tailored for small and medium-sized enterprises (SMEs), this package provides essential automation features to streamline business processes effectively."
30,Leapwork Microsoft products,
31,Description of leapwork products,SME Starter Package on Premise (Customize Enterprise edition): This customized version of the SME Starter Package allows SMEs to adapt automation capabilities according to their specific needs and growth plans.
32,leapwork pruducts with On premises,
33,Leapwork products with SaaS,SaaS Products:
34,Enterprise pakages leapwork,"Enterprise Starter Package SaaS: This package offers the same comprehensive automation features as the on-premise Enterprise Starter Package but in a cloud-based Software-as-a-Service model, providing scalability and flexibility."
35,Bundle products suported by leapwork,Microsoft-Specific Products:
36,Features products of leapwork,"Leapwork Enterprise Biz Apps Special Package: This package is tailored for enterprises leveraging Microsoft technologies, providing specialized automation capabilities for Microsoft business applications."
37,Cusstomize prdoducts of leapwork,
38,Does Leapwork support any,"Leapwork Enterprise Bundle Starter Package: This package is designed for enterprises using a bundle of Microsoft-specific applications, offering integrated automation solutions for enhanced productivity and efficiency."
,customizable products?,
39,Starter package,"These offerings showcase Leapwork's commitment to providing flexible and scalable automation solutions for businesses of all sizes and across various deployment environments, including on-premise and cloud-based infrastructures."
40,Cusstomize SaaS prdoducts of leapwork,
